{
  "$schema": "../schemas/archive.schema.json",
  "version": "{{VERSION}}",
  "project": "{{PROJECT_NAME}}",
  "_meta": {
    "totalArchived": 0,
    "lastArchived": null,
    "oldestTask": null,
    "newestTask": null
  },
  "archivedTasks": [],
  "statistics": {
    "byPhase": {},
    "byPriority": {
      "critical": 0,
      "high": 0,
      "medium": 0,
      "low": 0
    },
    "byLabel": {},
    "averageCycleTime": null
  }
}
